{
  "$schema": "../schemas/amalgam-index.schema.json",
  "schemaVersion": "amalgam-index-v2",
  "generated": true,
  "sourceCatalog": "data/disciplinas_v5_catalogo.json",
  "sourceCatalogChecksum": {
    "algorithm": "sha256",
    "value": "58c135359c8148b18da57a34de6e7c8df46a2ec0bd73d8672a2ea8dff0e18f13"
  },
  "entries": [
    {
      "requiredDiscipline": "Animalismo",
      "requiredLevel": 1,
      "recordId": "fortaleza_2_enduring_beasts",
      "recordKind": "power",
      "recordDiscipline": "Fortaleza",
      "recordLevel": 2,
      "recordName": {
        "en": "Enduring Beasts",
        "es": "Bestias Resistentes"
      }
    },
    {
      "requiredDiscipline": "Animalismo",
      "requiredLevel": 1,
      "recordId": "ofuscacion_2_ghost_s_passing",
      "recordKind": "power",
      "recordDiscipline": "Ofuscación",
      "recordLevel": 2,
      "recordName": {
        "en": "Ghost's Passing",
        "es": "Paso del Fantasma"
      }
    },
    {
      "requiredDiscipline": "Animalismo",
      "requiredLevel": 2,
      "recordId": "auspex_3_vermin_vision",
      "recordKind": "power",
      "recordDiscipline": "Auspex",
      "recordLevel": 3,
      "recordName": {
        "en": "Vermin Vision",
        "es": "Visión de Alimañas"
      }
    },
    {
      "requiredDiscipline": "Animalismo",
      "requiredLevel": 2,
      "recordId": "protean_5_one_with_the_land",
      "recordKind": "power",
      "recordDiscipline": "Protean",
      "recordLevel": 5,
      "recordName": {
        "en": "One with the Land",
        "es": "Uno con la Tierra"
      }
    },
    {
      "requiredDiscipline": "Auspex",
      "requiredLevel": 1,
      "recordId": "animalismo_2_animal_messenger",
      "recordKind": "power",
      "recordDiscipline": "Animalismo",
      "recordLevel": 2,
      "recordName": {
        "en": "Animal Messenger",
        "es": "Mensajero Animal"
      }
    },
    {
      "requiredDiscipline": "Auspex",
      "requiredLevel": 1,
      "recordId": "animalismo_3_augury",
      "recordKind": "power",
      "recordDiscipline": "Animalismo",
      "recordLevel": 3,
      "recordName": {
        "en": "Augury",
        "es": "Augurio"
      }
    },
    {
      "requiredDiscipline": "Auspex",
      "requiredLevel": 1,
      "recordId": "fortaleza_2_invigorating_vitae",
      "recordKind": "power",
      "recordDiscipline": "Fortaleza",
      "recordLevel": 2,
      "recordName": {
        "en": "Invigorating Vitae",
        "es": "Vitae Vigorizante"
      }
    },
    {
      "requiredDiscipline": "Auspex",
      "requiredLevel": 1,
      "recordId": "fortaleza_3_valeren",
      "recordKind": "power",
      "recordDiscipline": "Fortaleza",
      "recordLevel": 3,
      "recordName": {
        "en": "Valeren",
        "es": "Valeren"
      }
    },
    {
      "requiredDiscipline": "Auspex",
      "requiredLevel": 1,
      "recordId": "ofuscacion_2_doubletalk",
      "recordKind": "power",
      "recordDiscipline": "Ofuscación",
      "recordLevel": 2,
      "recordName": {
        "en": "Doubletalk",
        "es": "Doble Habla"
      }
    },
    {
      "requiredDiscipline": "Auspex",
      "requiredLevel": 1,
      "recordId": "olvido_3_shadow_servant",
      "recordKind": "power",
      "recordDiscipline": "Olvido",
      "recordLevel": 3,
      "recordName": {
        "en": "Shadow Servant",
        "es": "Sirviente Sombrío"
      }
    },
    {
      "requiredDiscipline": "Auspex",
      "requiredLevel": 1,
      "recordId": "presencia_3_thrown_voice",
      "recordKind": "power",
      "recordDiscipline": "Presencia",
      "recordLevel": 3,
      "recordName": {
        "en": "Thrown Voice",
        "es": "Voz Arrojada"
      }
    },
    {
      "requiredDiscipline": "Auspex",
      "requiredLevel": 2,
      "recordId": "celeridad_4_unerring_aim",
      "recordKind": "power",
      "recordDiscipline": "Celeridad",
      "recordLevel": 4,
      "recordName": {
        "en": "Unerring Aim",
        "es": "Puntería Certera"
      }
    },
    {
      "requiredDiscipline": "Auspex",
      "requiredLevel": 2,
      "recordId": "ofuscacion_2_ventriloquism",
      "recordKind": "power",
      "recordDiscipline": "Ofuscación",
      "recordLevel": 2,
      "recordName": {
        "en": "Ventriloquism",
        "es": "Ventriloquía"
      }
    },
    {
      "requiredDiscipline": "Auspex",
      "requiredLevel": 2,
      "recordId": "olvido_2_fatal_precognition",
      "recordKind": "power",
      "recordDiscipline": "Olvido",
      "recordLevel": 2,
      "recordName": {
        "en": "Fatal Precognition",
        "es": "Premonición Fatal"
      }
    },
    {
      "requiredDiscipline": "Auspex",
      "requiredLevel": 2,
      "recordId": "olvido_2_fatal_prediction",
      "recordKind": "power",
      "recordDiscipline": "Olvido",
      "recordLevel": 2,
      "recordName": {
        "en": "Fatal Prediction",
        "es": "Predicción Fatal"
      }
    },
    {
      "requiredDiscipline": "Auspex",
      "requiredLevel": 2,
      "recordId": "presencia_3_passion_leech",
      "recordKind": "power",
      "recordDiscipline": "Presencia",
      "recordLevel": 3,
      "recordName": {
        "en": "Passion Leech",
        "es": "Sanguijuela de Pasiones"
      }
    },
    {
      "requiredDiscipline": "Auspex",
      "requiredLevel": 3,
      "recordId": "ofuscacion_4_conceal",
      "recordKind": "power",
      "recordDiscipline": "Ofuscación",
      "recordLevel": 4,
      "recordName": {
        "en": "Conceal",
        "es": "Ocultar"
      }
    },
    {
      "requiredDiscipline": "Auspex",
      "requiredLevel": 3,
      "recordId": "presencia_4_magnum_opus",
      "recordKind": "power",
      "recordDiscipline": "Presencia",
      "recordLevel": 4,
      "recordName": {
        "en": "Magnum Opus",
        "es": "Magnum Opus"
      }
    },
    {
      "requiredDiscipline": "Dominación",
      "requiredLevel": 1,
      "recordId": "animalismo_3_messenger_s_command",
      "recordKind": "power",
      "recordDiscipline": "Animalismo",
      "recordLevel": 3,
      "recordName": {
        "en": "Messenger's Command",
        "es": "Orden del Mensajero"
      }
    },
    {
      "requiredDiscipline": "Dominación",
      "requiredLevel": 1,
      "recordId": "auspex_2_unerring_pursuit",
      "recordKind": "power",
      "recordDiscipline": "Auspex",
      "recordLevel": 2,
      "recordName": {
        "en": "Unerring Pursuit",
        "es": "Búsqueda Infalible"
      }
    },
    {
      "requiredDiscipline": "Dominación",
      "requiredLevel": 1,
      "recordId": "ofuscacion_3_mask_of_isolation",
      "recordKind": "power",
      "recordDiscipline": "Ofuscación",
      "recordLevel": 3,
      "recordName": {
        "en": "Mask of Isolation",
        "es": "Máscara de Aislamiento"
      }
    },
    {
      "requiredDiscipline": "Dominación",
      "requiredLevel": 1,
      "recordId": "ofuscacion_3_mental_maze",
      "recordKind": "power",
      "recordDiscipline": "Ofuscación",
      "recordLevel": 3,
      "recordName": {
        "en": "Mental Maze",
        "es": "Laberinto Mental"
      }
    },
    {
      "requiredDiscipline": "Dominación",
      "requiredLevel": 1,
      "recordId": "ofuscacion_4_seclusion",
      "recordKind": "power",
      "recordDiscipline": "Ofuscación",
      "recordLevel": 4,
      "recordName": {
        "en": "Seclusion",
        "es": "Reclusión"
      }
    },
    {
      "requiredDiscipline": "Dominación",
      "requiredLevel": 1,
      "recordId": "presencia_4_irresistible_voice",
      "recordKind": "power",
      "recordDiscipline": "Presencia",
      "recordLevel": 4,
      "recordName": {
        "en": "Irresistible Voice",
        "es": "Voz Irresistible"
      }
    },
    {
      "requiredDiscipline": "Dominación",
      "requiredLevel": 2,
      "recordId": "ofuscacion_3_mind_masque",
      "recordKind": "power",
      "recordDiscipline": "Ofuscación",
      "recordLevel": 3,
      "recordName": {
        "en": "Mind Masque",
        "es": "Mascarada Mental"
      }
    },
    {
      "requiredDiscipline": "Dominación",
      "requiredLevel": 2,
      "recordId": "protean_2_vicissitude",
      "recordKind": "power",
      "recordDiscipline": "Protean",
      "recordLevel": 2,
      "recordName": {
        "en": "Vicissitude",
        "es": "Vicisitud"
      }
    },
    {
      "requiredDiscipline": "Dominación",
      "requiredLevel": 2,
      "recordId": "protean_3_fleshcrafting",
      "recordKind": "power",
      "recordDiscipline": "Protean",
      "recordLevel": 3,
      "recordName": {
        "en": "Fleshcrafting",
        "es": "Moldear Carne"
      }
    },
    {
      "requiredDiscipline": "Dominación",
      "requiredLevel": 2,
      "recordId": "protean_4_horrid_form",
      "recordKind": "power",
      "recordDiscipline": "Protean",
      "recordLevel": 4,
      "recordName": {
        "en": "Horrid Form",
        "es": "Forma Horrenda"
      }
    },
    {
      "requiredDiscipline": "Dominación",
      "requiredLevel": 3,
      "recordId": "auspex_5_possession",
      "recordKind": "power",
      "recordDiscipline": "Auspex",
      "recordLevel": 5,
      "recordName": {
        "en": "Possession",
        "es": "Posesión"
      }
    },
    {
      "requiredDiscipline": "Dominación",
      "requiredLevel": 3,
      "recordId": "auspex_5_unburdening_the_bestial_soul",
      "recordKind": "power",
      "recordDiscipline": "Auspex",
      "recordLevel": 5,
      "recordName": {
        "en": "Unburdening the Bestial Soul",
        "es": "Alivio del Alma Bestial"
      }
    },
    {
      "requiredDiscipline": "Dominación",
      "requiredLevel": 3,
      "recordId": "presencia_3_clear_the_field",
      "recordKind": "power",
      "recordDiscipline": "Presencia",
      "recordLevel": 3,
      "recordName": {
        "en": "Clear the Field",
        "es": "Despejar el Campo"
      }
    },
    {